{
  "artifactVersion": "s12.f-rf.internal-poc-review.v2",
  "candidateDigest": "sha256:683238444878da378e5f7b3ae7ba90457b85b87222e74927a011257c3557b922",
  "candidatePath": "evaluation/sprint-12/internal-poc/s12-f-rf-internal-poc-candidate.v2.json",
  "heldOutInspection": false,
  "humanEvidence": false,
  "manualBaseline": {
    "pairedRecords": 0,
    "status": "NOT_RUN_NO_HUMAN_REVIEWER"
  },
  "metrics": {
    "acceptedUnchangedOrMinor": {
      "numerator": 0,
      "rate": 0.0,
      "threshold": 0.85
    },
    "acceptedWithoutSemanticCorrection": {
      "numerator": 0,
      "rate": 0.0,
      "threshold": 0.7
    },
    "eligibleReviewedItems": 12,
    "gateStatus": "FAIL_NO_HUMAN_BASELINE_OR_AGREEMENT",
    "manualBaselineReduction": null,
    "meanSemanticEditsPerReviewedItem": 0.0,
    "medianEffortProxySeconds": 1,
    "reviewerAgreement": {
      "independentRecords": 0,
      "status": "NOT_APPLICABLE_BLOCKS_GATE"
    },
    "unsupportedFinalizedAssertions": {
      "denominator": 0,
      "numerator": 0,
      "status": "NOT_APPLICABLE_BLOCKS_GATE"
    }
  },
  "nonClaims": [
    "agent-proxy review is not human or independent evidence",
    "effort proxy is not review latency and no manual baseline was run",
    "no RM-68 acceptance, external validation, business-quality claim, provider, held-out, or production authority"
  ],
  "providerCalls": 0,
  "records": [
    {
      "candidateDigest": "sha256:28009e3c0c473786b1d6aec915ea72794960d798476e0af1bae9a4cecc87acb3",
      "candidateOutputStatus": "abstained",
      "caseId": "s12-a-4001",
      "correctionClass": "not-applicable",
      "effortProxySeconds": 1,
      "eligibleForAcceptance": false,
      "finalDisposition": "abstained",
      "integrityStatus": "source-version-bound",
      "manualBaselineSeconds": null,
      "recordId": "poc-review-v2-001",
      "reviewer": "primary-agent-proxy",
      "scenarioId": "s12-s-201",
      "semanticEditCount": 0,
      "sourceDigest": "sha256:f819e04d5af8f0a582b396edea3f5616abe895fb07b07c13106e374fd1141de0",
      "timingStatus": "agent-proxy-effort-only",
      "unsupportedFinalizedAssertions": 0
    },
    {
      "candidateDigest": "sha256:28009e3c0c473786b1d6aec915ea72794960d798476e0af1bae9a4cecc87acb3",
      "candidateOutputStatus": "abstained",
      "caseId": "s12-a-4011",
      "correctionClass": "not-applicable",
      "effortProxySeconds": 1,
      "eligibleForAcceptance": false,
      "finalDisposition": "abstained",
      "integrityStatus": "source-version-bound",
      "manualBaselineSeconds": null,
      "recordId": "poc-review-v2-002",
      "reviewer": "primary-agent-proxy",
      "scenarioId": "s12-s-202",
      "semanticEditCount": 0,
      "sourceDigest": "sha256:5d8f5f7c7797ada99cb69cd7be15fb0ad19bfc95b4c9f91ca6dabeb4360ac35a",
      "timingStatus": "agent-proxy-effort-only",
      "unsupportedFinalizedAssertions": 0
    },
    {
      "candidateDigest": "sha256:28009e3c0c473786b1d6aec915ea72794960d798476e0af1bae9a4cecc87acb3",
      "candidateOutputStatus": "abstained",
      "caseId": "s12-a-4021",
      "correctionClass": "not-applicable",
      "effortProxySeconds": 1,
      "eligibleForAcceptance": false,
      "finalDisposition": "abstained",
      "integrityStatus": "source-version-bound",
      "manualBaselineSeconds": null,
      "recordId": "poc-review-v2-003",
      "reviewer": "primary-agent-proxy",
      "scenarioId": "s12-s-203",
      "semanticEditCount": 0,
      "sourceDigest": "sha256:3c79f39f07cc6a5e03ba969247fe7062d31dafccda40e962b331d8fa1c671ff9",
      "timingStatus": "agent-proxy-effort-only",
      "unsupportedFinalizedAssertions": 0
    },
    {
      "candidateDigest": "sha256:28009e3c0c473786b1d6aec915ea72794960d798476e0af1bae9a4cecc87acb3",
      "candidateOutputStatus": "abstained",
      "caseId": "s12-a-4031",
      "correctionClass": "not-applicable",
      "effortProxySeconds": 1,
      "eligibleForAcceptance": false,
      "finalDisposition": "abstained",
      "integrityStatus": "source-version-bound",
      "manualBaselineSeconds": null,
      "recordId": "poc-review-v2-004",
      "reviewer": "primary-agent-proxy",
      "scenarioId": "s12-s-204",
      "semanticEditCount": 0,
      "sourceDigest": "sha256:f38b457203e618b709ccac1db43f9e115be1e646b55713b89c6c4c535dd54326",
      "timingStatus": "agent-proxy-effort-only",
      "unsupportedFinalizedAssertions": 0
    },
    {
      "candidateDigest": "sha256:28009e3c0c473786b1d6aec915ea72794960d798476e0af1bae9a4cecc87acb3",
      "candidateOutputStatus": "abstained",
      "caseId": "s12-a-4033",
      "correctionClass": "not-applicable",
      "effortProxySeconds": 1,
      "eligibleForAcceptance": false,
      "finalDisposition": "abstained",
      "integrityStatus": "source-version-bound",
      "manualBaselineSeconds": null,
      "recordId": "poc-review-v2-005",
      "reviewer": "primary-agent-proxy",
      "scenarioId": "s12-s-205",
      "semanticEditCount": 0,
      "sourceDigest": "sha256:5c1b2fa1a2f18395170c950535b3ee64f73e9bc7f16176cf5d14d20724cc2343",
      "timingStatus": "agent-proxy-effort-only",
      "unsupportedFinalizedAssertions": 0
    },
    {
      "candidateDigest": "sha256:28009e3c0c473786b1d6aec915ea72794960d798476e0af1bae9a4cecc87acb3",
      "candidateOutputStatus": "abstained",
      "caseId": "s12-a-4043",
      "correctionClass": "not-applicable",
      "effortProxySeconds": 1,
      "eligibleForAcceptance": false,
      "finalDisposition": "abstained",
      "integrityStatus": "source-version-bound",
      "manualBaselineSeconds": null,
      "recordId": "poc-review-v2-006",
      "reviewer": "primary-agent-proxy",
      "scenarioId": "s12-s-206",
      "semanticEditCount": 0,
      "sourceDigest": "sha256:88ac05c716de8635dfe786ad637d8b2f55792554a2e2a0a0767fc446a181e1e0",
      "timingStatus": "agent-proxy-effort-only",
      "unsupportedFinalizedAssertions": 0
    },
    {
      "candidateDigest": "sha256:28009e3c0c473786b1d6aec915ea72794960d798476e0af1bae9a4cecc87acb3",
      "candidateOutputStatus": "abstained",
      "caseId": "s12-a-4053",
      "correctionClass": "not-applicable",
      "effortProxySeconds": 1,
      "eligibleForAcceptance": false,
      "finalDisposition": "abstained",
      "integrityStatus": "source-version-bound",
      "manualBaselineSeconds": null,
      "recordId": "poc-review-v2-007",
      "reviewer": "primary-agent-proxy",
      "scenarioId": "s12-s-207",
      "semanticEditCount": 0,
      "sourceDigest": "sha256:2ebbce8d2a2e3b491aefe56ebf9fee81948111346a056c93dcf701179ac024e7",
      "timingStatus": "agent-proxy-effort-only",
      "unsupportedFinalizedAssertions": 0
    },
    {
      "candidateDigest": "sha256:28009e3c0c473786b1d6aec915ea72794960d798476e0af1bae9a4cecc87acb3",
      "candidateOutputStatus": "abstained",
      "caseId": "s12-a-4063",
      "correctionClass": "not-applicable",
      "effortProxySeconds": 1,
      "eligibleForAcceptance": false,
      "finalDisposition": "abstained",
      "integrityStatus": "source-version-bound",
      "manualBaselineSeconds": null,
      "recordId": "poc-review-v2-008",
      "reviewer": "primary-agent-proxy",
      "scenarioId": "s12-s-208",
      "semanticEditCount": 0,
      "sourceDigest": "sha256:1c75fbbda9e55406457cfaa5bf8e920613662481aa9cb6fc138afb0fc0ee8533",
      "timingStatus": "agent-proxy-effort-only",
      "unsupportedFinalizedAssertions": 0
    },
    {
      "candidateDigest": "sha256:28009e3c0c473786b1d6aec915ea72794960d798476e0af1bae9a4cecc87acb3",
      "candidateOutputStatus": "abstained",
      "caseId": "s12-a-4065",
      "correctionClass": "not-applicable",
      "effortProxySeconds": 1,
      "eligibleForAcceptance": false,
      "finalDisposition": "abstained",
      "integrityStatus": "source-version-bound",
      "manualBaselineSeconds": null,
      "recordId": "poc-review-v2-009",
      "reviewer": "primary-agent-proxy",
      "scenarioId": "s12-s-209",
      "semanticEditCount": 0,
      "sourceDigest": "sha256:621c59713e2d3fbfe7cd5fadcc9225123114c79df3590d49b712932afb45f77f",
      "timingStatus": "agent-proxy-effort-only",
      "unsupportedFinalizedAssertions": 0
    },
    {
      "candidateDigest": "sha256:28009e3c0c473786b1d6aec915ea72794960d798476e0af1bae9a4cecc87acb3",
      "candidateOutputStatus": "abstained",
      "caseId": "s12-a-4075",
      "correctionClass": "not-applicable",
      "effortProxySeconds": 1,
      "eligibleForAcceptance": false,
      "finalDisposition": "abstained",
      "integrityStatus": "source-version-bound",
      "manualBaselineSeconds": null,
      "recordId": "poc-review-v2-010",
      "reviewer": "primary-agent-proxy",
      "scenarioId": "s12-s-210",
      "semanticEditCount": 0,
      "sourceDigest": "sha256:aa5bbf385580fc7b21febb4340c252c66cbe7d3bdce11930c54a370b5057c02e",
      "timingStatus": "agent-proxy-effort-only",
      "unsupportedFinalizedAssertions": 0
    },
    {
      "candidateDigest": "sha256:28009e3c0c473786b1d6aec915ea72794960d798476e0af1bae9a4cecc87acb3",
      "candidateOutputStatus": "abstained",
      "caseId": "s12-a-4085",
      "correctionClass": "not-applicable",
      "effortProxySeconds": 1,
      "eligibleForAcceptance": false,
      "finalDisposition": "abstained",
      "integrityStatus": "source-version-bound",
      "manualBaselineSeconds": null,
      "recordId": "poc-review-v2-011",
      "reviewer": "primary-agent-proxy",
      "scenarioId": "s12-s-211",
      "semanticEditCount": 0,
      "sourceDigest": "sha256:ba407c680bd1013c47d57b0b21f2bac2510ccb6a3a49e1e30ce26f1e75324bba",
      "timingStatus": "agent-proxy-effort-only",
      "unsupportedFinalizedAssertions": 0
    },
    {
      "candidateDigest": "sha256:28009e3c0c473786b1d6aec915ea72794960d798476e0af1bae9a4cecc87acb3",
      "candidateOutputStatus": "abstained",
      "caseId": "s12-a-4095",
      "correctionClass": "not-applicable",
      "effortProxySeconds": 1,